{
 "format": "cultivate-needs/1",
 "product": "Zed",
 "run": {
  "at": "2026-10-26",
  "previous": "2026-09-20",
  "window": {
   "from": "2025-10-27",
   "to": "2026-10-25"
  }
 },
 "scope": {
  "channels": [
   {
    "channel": "github.com/zed-industries/zed",
    "sources": [
     "github-discussions",
     "github-issues"
    ],
    "items": 1620
   }
  ],
  "note": "the threads of the 36 needs on the September report and the duplicates found for them, not the whole tracker"
 },
 "features": {
  "source": "Zed's 75-feature category map, scripts/validation/category/category-map.json"
 },
 "rules": {
  "merge_at": 0.7,
  "quiet_after_days": 180,
  "movement": "A need moves when its last 4 weeks are 2 times its usual rate or more, or half or less, by at least 20 events.",
  "intent_to_leave": "3 or more different people say they would leave, above the base rate of every judged comment with a one-sided Poisson p under 0.01"
 },
 "judge": {
  "model": "jev-1.13.0",
  "questions": "same: cultivate.judge.PAIR_Q; intent to leave: scripts/board/feel.py feel-v1"
 },
 "needs": [
  {
   "id": "need:0529d28076fbd702",
   "lead": "0529d28076fbd70263befa67389314220fc4590f244d4f6137feaf556bce8806",
   "label": "GitHub Copilot broken in v0.222.3",
   "label_source": "lead_title",
   "kind": "problem",
   "features": [
    {
     "name": "AI model providers, keys, plans and quotas",
     "confident": true
    }
   ],
   "members": [
    {
     "item": "0529d28076fbd70263befa67389314220fc4590f244d4f6137feaf556bce8806",
     "url": "https://github.com/zed-industries/zed/issues/48543",
     "said_at": "2026-02-06",
     "lead": true,
     "same": null
    },
    {
     "item": "a6735c36b078346b1ace8a72b37c40248c6300b2492713deb4f79d123d2712b9",
     "url": "https://github.com/zed-industries/zed/issues/62592",
     "said_at": "2026-08-13",
     "lead": false,
     "same": 0.94
    },
    {
     "item": "efe5a4f679df935f0c9088e5a00debb60d180ffbf3b8f9cdf87306e51ea89ff6",
     "url": "https://github.com/zed-industries/zed/issues/59532",
     "said_at": "2026-06-18",
     "lead": false,
     "same": 0.87
    },
    {
     "item": "bdbf6ab5bfe79c0e4610477137feccf4874ab931859b73fb939939e894349a05",
     "url": "https://github.com/zed-industries/zed/issues/58194",
     "said_at": "2026-06-01",
     "lead": false,
     "same": 0.79
    },
    {
     "item": "c26e9d6d1b9f493f931e4ecb09629849a6923ed79ec01e263d07561e43d6a8d9",
     "url": "https://github.com/zed-industries/zed/issues/60029",
     "said_at": "2026-06-28",
     "lead": false,
     "same": 0.77
    }
   ],
   "first_seen": "2026-02-06",
   "last_seen": "2026-10-25",
   "people": {
    "wanting": {
     "count": 116,
     "in_window": 116,
     "first_seen": "2026-02-06",
     "last_seen": "2026-10-25",
     "by_month": {
      "2026-02": 40,
      "2026-06": 17,
      "2026-07": 37,
      "2026-08": 18,
      "2026-09": 8,
      "2026-10": 6
     },
     "basis": "everyone who opened, commented on or reacted to the need's threads, by GitHub handle hash; maintainers' replies are not yet told apart"
    },
    "paying": {
     "count": null,
     "in_window": null,
     "first_seen": null,
     "last_seen": null,
     "by_month": {},
     "basis": "not measured: no source read reaches paying people for this product"
    },
    "building": {
     "count": null,
     "in_window": null,
     "first_seen": null,
     "last_seen": null,
     "by_month": {},
     "basis": "not measured: no source read reaches people building for this need"
    },
    "gone_quiet": {
     "count": 39,
     "in_window": 39,
     "first_seen": "2026-02-06",
     "last_seen": "2026-02-09",
     "by_month": {
      "2026-02": 39
     },
     "basis": "wanting people whose last engagement with this need was more than 180 days before the run; by_month is the month they were last seen"
    }
   },
   "state": {
    "status": "answered",
    "at": "2026-02-06",
    "how": "the lead thread was closed as completed"
   },
   "activity": {
    "week_from": "2025-10-27",
    "weekly": [
     0,
     0,
     0,
     0,
     0,
     0,
     0,
     0,
     0,
     0,
     0,
     0,
     0,
     0,
     46,
     2,
     0,
     0,
     0,
     0,
     0,
     0,
     0,
     0,
     0,
     0,
     0,
     0,
     0,
     0,
     0,
     2,
     0,
     2,
     7,
     20,
     11,
     4,
     6,
     8,
     4,
     8,
     7,
     5,
     4,
     0,
     2,
     1,
     3,
     1,
     6,
     1
    ]
   },
   "signals": []
  },
  {
   "id": "need:0ad2e12756c3f60a",
   "lead": "0ad2e12756c3f60a736abb19a5fd0f63aba7fedc0db4199f5438d78b8ab016e6",
   "label": "Git status synchronization failure in Git Panel, Editor, and Project Panel",
   "label_source": "lead_title",
   "kind": "problem",
   "features": [
    {
     "name": "Staging and committing changes",
     "confident": true
    }
   ],
   "members": [
    {
     "item": "0ad2e12756c3f60a736abb19a5fd0f63aba7fedc0db4199f5438d78b8ab016e6",
     "url": "https://github.com/zed-industries/zed/issues/51398",
     "said_at": "2026-03-12",
     "lead": true,
     "same": null
    },
    {
     "item": "f3ddf7867eac14886ae11e7d42ad7c26ef5a03996f259fed106d05e3aa725819",
     "url": "https://github.com/zed-industries/zed/issues/60102",
     "said_at": "2026-06-29",
     "lead": false,
     "same": 0.91
    },
    {
     "item": "f05fe0dfcfa7dde1a470dc357f1b25b223c8cd70896a2766c6681dc96c09edaa",
     "url": "https://github.com/zed-industries/zed/issues/64729",
     "said_at": "2026-09-24",
     "lead": false,
     "same": 0.89
    },
    {
     "item": "e58d9886e9c93e6a88638c882420f47407803f37c0467ffd05843670168c5b2a",
     "url": "https://github.com/zed-industries/zed/issues/55590",
     "said_at": "2026-05-04",
     "lead": false,
     "same": 0.88
    },
    {
     "item": "5b612dc74f13e37c88b8a75a8fcfe12990dc5f0d2a48ca4eafaa6bc964022f94",
     "url": "https://github.com/zed-industries/zed/discussions/48583",
     "said_at": "2026-02-06",
     "lead": false,
     "same": 0.84
    },
    {
     "item": "423ee4b676fe9e4bb6c108d27e0c9b78da0bbe341dcaf2d1affc791c72ff6651",
     "url": "https://github.com/zed-industries/zed/issues/52427",
     "said_at": "2026-03-25",
     "lead": false,
     "same": 0.83
    },
    {
     "item": "6ce994bb9c82530bc2478cddfa602c2cd3cf664755ee3c5d467e989ff4cb0e1a",
     "url": "https://github.com/zed-industries/zed/issues/60241",
     "said_at": "2026-07-02",
     "lead": false,
     "same": 0.79
    },
    {
     "item": "1e578930774140251b721d289fec00ff7edfe626113355f559c8944d2cffe62d",
     "url": "https://github.com/zed-industries/zed/issues/64206",
     "said_at": "2026-09-15",
     "lead": false,
     "same": 0.73
    },
    {
     "item": "3b34ef6273550b94e173e100a891f23e103c53bfa0f585903d4a182f269b4f0d",
     "url": "https://github.com/zed-industries/zed/issues/60882",
     "said_at": "2026-07-13",
     "lead": false,
     "same": 0.71
    },
    {
     "item": "ac4742630f913bbc28ab71c2e5860cfc81ced584c68fac861410ba48e80667b9",
     "url": "https://github.com/zed-industries/zed/issues/65332",
     "said_at": "2026-10-08",
     "lead": false,
     "same": 0.7
    }
   ],
   "first_seen": "2026-02-06",
   "last_seen": "2026-10-23",
   "people": {
    "wanting": {
     "count": 110,
     "in_window": 110,
     "first_seen": "2026-02-06",
     "last_seen": "2026-10-23",
     "by_month": {
      "2026-02": 1,
      "2026-03": 13,
      "2026-04": 19,
      "2026-05": 9,
      "2026-06": 5,
      "2026-07": 49,
      "2026-08": 3,
      "2026-09": 6,
      "2026-10": 17
     },
     "basis": "everyone who opened, commented on or reacted to the need's threads, by GitHub handle hash; maintainers' replies are not yet told apart"
    },
    "paying": {
     "count": null,
     "in_window": null,
     "first_seen": null,
     "last_seen": null,
     "by_month": {},
     "basis": "not measured: no source read reaches paying people for this product"
    },
    "building": {
     "count": null,
     "in_window": null,
     "first_seen": null,
     "last_seen": null,
     "by_month": {},
     "basis": "not measured: no source read reaches people building for this need"
    },
    "gone_quiet": {
     "count": 29,
     "in_window": 29,
     "first_seen": "2026-02-06",
     "last_seen": "2026-04-28",
     "by_month": {
      "2026-02": 1,
      "2026-03": 10,
      "2026-04": 18
     },
     "basis": "wanting people whose last engagement with this need was more than 180 days before the run; by_month is the month they were last seen"
    }
   },
   "state": {
    "status": "closed",
    "at": "2026-05-04",
    "how": "the lead thread was closed as duplicate"
   },
   "activity": {
    "week_from": "2025-10-27",
    "weekly": [
     0,
     0,
     0,
     0,
     0,
     0,
     0,
     0,
     0,
     0,
     0,
     0,
     0,
     0,
     0,
     0,
     0,
     0,
     0,
     2,
     9,
     6,
     5,
     8,
     6,
     9,
     5,
     5,
     2,
     0,
     0,
     0,
     1,
     0,
     0,
     30,
     13,
     12,
     14,
     2,
     1,
     2,
     0,
     0,
     2,
     0,
     1,
     1,
     2,
     3,
     10,
     15
    ]
   },
   "signals": []
  },
  {
   "id": "need:108faae0fe21bf81",
   "lead": "108faae0fe21bf81f2c8e5e9b4d4511de0034d0b63b98b864a0b4484dcc38d92",
   "label": "Diffing two branches (Similar to jet brains)",
   "label_source": "lead_title",
   "kind": "ask",
   "features": [
    {
     "name": "Changed-line marks and diffs",
     "confident": true
    }
   ],
   "members": [
    {
     "item": "108faae0fe21bf81f2c8e5e9b4d4511de0034d0b63b98b864a0b4484dcc38d92",
     "url": "https://github.com/zed-industries/zed/discussions/55880",
     "said_at": "2026-05-06",
     "lead": true,
     "same": null
    }
   ],
   "first_seen": "2026-05-06",
   "last_seen": "2026-05-06",
   "people": {
    "wanting": {
     "count": 1,
     "in_window": 1,
     "first_seen": "2026-05-06",
     "last_seen": "2026-05-06",